{
  "artifact_types": [
    "hypothesis register",
    "experiment options",
    "selected experiment contract",
    "stopping and analysis criteria"
  ],
  "capability_id": "capability:solution-hypothesis-and-experiment-design",
  "execution": {
    "adapter": "artifact",
    "model_tools": [
      "read",
      "write"
    ],
    "mutation_scope": "run-output",
    "remote_write": false
  },
  "forbidden_actions": [
    "remote Git, pull-request mutation, merge, deploy, cloud mutation, or external-system write",
    "invent facts, evidence, authority, approval, or customer data",
    "perform adjacent or downstream capability responsibilities",
    "claim Phase 9 evaluation or release evidence that has not run"
  ],
  "hard_gates": [
    "A test without a falsifiable prediction, counterfactual, and predeclared success or kill criterion is not an experiment contract.",
    "Preserve conflicts, counterevidence, unknowns, source identity, and authority boundaries."
  ],
  "id": "solution-hypothesis-and-experiment-design",
  "inputs": [
    "A framed problem, prioritized opportunity, assumptions, risks, and available experiment conditions."
  ],
  "outputs": [
    "hypothesis register",
    "experiment options",
    "selected experiment contract",
    "stopping and analysis criteria"
  ],
  "permission_identity": "workspace-write",
  "policy": {
    "data_governance": true,
    "human_decision": true,
    "named_formula_variants": false
  },
  "responsibility": "Turn a validated problem into falsifiable solution hypotheses and proportionate experiments with predeclared evidence and stopping criteria.",
  "schema_version": "2.0",
  "status": "evaluating",
  "statuses": [
    "passed",
    "needs-input",
    "blocked",
    "failed"
  ],
  "version": "0.1.0-v2-candidate"
}
