{
  "artifact_types": [
    "problem frame",
    "classification register",
    "conflict register",
    "critical gap list"
  ],
  "capability_id": "capability:problem-framing-and-customer-research",
  "execution": {
    "adapter": "artifact",
    "model_tools": [
      "read",
      "write"
    ],
    "mutation_scope": "run-output",
    "remote_write": false
  },
  "forbidden_actions": [
    "remote Git, pull-request mutation, merge, deploy, cloud mutation, or external-system write",
    "invent facts, evidence, authority, approval, or customer data",
    "perform adjacent or downstream capability responsibilities",
    "claim Phase 9 evaluation or release evidence that has not run"
  ],
  "hard_gates": [
    "Any proposed feature, mechanism, vendor, architecture, or implied solution in the problem frame is a boundary failure.",
    "Preserve conflicts, counterevidence, unknowns, source identity, and authority boundaries."
  ],
  "id": "problem-framing-and-customer-research",
  "inputs": [
    "A problem hypothesis, target users, prior research, access constraints, and a decision to support."
  ],
  "outputs": [
    "problem frame",
    "classification register",
    "conflict register",
    "critical gap list"
  ],
  "permission_identity": "workspace-write",
  "policy": {
    "data_governance": true,
    "human_decision": false,
    "named_formula_variants": false
  },
  "responsibility": "Create a solution-free problem frame by classifying supplied customer evidence, facts, assumptions, conflicts, impacts, and gaps.",
  "schema_version": "2.0",
  "status": "evaluating",
  "statuses": [
    "passed",
    "needs-input",
    "blocked",
    "failed"
  ],
  "version": "0.1.0-v2-candidate"
}
