{
  "artifact_types": [
    "interview guide",
    "consent and governance record",
    "observation log",
    "follow-up register"
  ],
  "capability_id": "capability:customer-interview-execution",
  "execution": {
    "adapter": "artifact",
    "model_tools": [
      "read",
      "write"
    ],
    "mutation_scope": "run-output",
    "remote_write": false
  },
  "forbidden_actions": [
    "remote Git, pull-request mutation, merge, deploy, cloud mutation, or external-system write",
    "invent facts, evidence, authority, approval, or customer data",
    "perform adjacent or downstream capability responsibilities",
    "claim Phase 9 evaluation or release evidence that has not run"
  ],
  "hard_gates": [
    "Do not recruit, contact, record, retain, or transfer participant data without explicit authorization and governance terms.",
    "Preserve conflicts, counterevidence, unknowns, source identity, and authority boundaries."
  ],
  "id": "customer-interview-execution",
  "inputs": [
    "A research objective, participant context, consent boundary, and interview script."
  ],
  "outputs": [
    "interview guide",
    "consent and governance record",
    "observation log",
    "follow-up register"
  ],
  "permission_identity": "workspace-write",
  "policy": {
    "data_governance": true,
    "human_decision": false,
    "named_formula_variants": false
  },
  "responsibility": "Prepare and conduct a non-leading, consented interview session and preserve observation separately from interpretation.",
  "schema_version": "2.0",
  "status": "evaluating",
  "statuses": [
    "passed",
    "needs-input",
    "blocked",
    "failed"
  ],
  "version": "0.1.0-v2-candidate"
}
