{
  "artifact_types": [
    "structural power assessment",
    "mechanism evidence map",
    "counterevidence and decay register",
    "moat hypothesis backlog"
  ],
  "capability_id": "capability:structural-power-and-moats",
  "execution": {
    "adapter": "artifact",
    "model_tools": [
      "read",
      "write"
    ],
    "mutation_scope": "run-output",
    "remote_write": false
  },
  "forbidden_actions": [
    "remote Git, pull-request mutation, merge, deploy, cloud mutation, or external-system write",
    "invent facts, evidence, authority, approval, or customer data",
    "perform adjacent or downstream capability responsibilities",
    "claim Phase 9 evaluation or release evidence that has not run"
  ],
  "hard_gates": [
    "Growth, market share, brand awareness, proprietary data, or technical complexity alone must not be labeled a moat without a durable causal mechanism.",
    "Preserve conflicts, counterevidence, unknowns, source identity, and authority boundaries."
  ],
  "id": "structural-power-and-moats",
  "inputs": [
    "A proposed advantage, customer evidence, cost structure, workflow, and imitation scenario."
  ],
  "outputs": [
    "structural power assessment",
    "mechanism evidence map",
    "counterevidence and decay register",
    "moat hypothesis backlog"
  ],
  "permission_identity": "workspace-write",
  "policy": {
    "data_governance": true,
    "human_decision": true,
    "named_formula_variants": false
  },
  "responsibility": "Assess durable structural advantage mechanisms, prerequisites, counterevidence, decay, and imitation risk without treating current performance as a moat.",
  "schema_version": "2.0",
  "status": "evaluating",
  "statuses": [
    "passed",
    "needs-input",
    "blocked",
    "failed"
  ],
  "version": "0.1.0-v2-candidate"
}
